question,answer,relevant_doc,doc_id
How many reactions have the message saying Georgia went from red to blue in the last election?,1,I live in the state of Georgia and was proud to see our state go from red to blue last election. The people voted and they did not want Trump. I'm confident we will vote that way again. People are still a little shocked by Biden's sudden departure and need a little time to get to know Kamala. The grassroots campaigning is kicking off. There is plenty of time before November. Georgia will be blue again.,73554
How many reactions have the message reporting that a Palestinian boy used a rock to take out a drone?,2,"Seen a Palestinian boy of around 8 years old taking out an IOF drone in Gaza with a rock. Fuck me, absolutely amazing.",601083
How many reactions have the message stating that Mohammed al-Jabari was eliminated by the IDF in a targeted operation?,0,"During a targeted, intelligence-based operation, the IDF eliminated the terrorist Mohammed al-Jabari, who was deputy head of weapons manufacturing for the Islamic Jihad. Al-Jabari was responsible for financing weapons manufacturing infrastructure for the Islamic Jihad in northern Gaza, the distribution of salaries and funds, and was part of attempts to restore the Islamic Jihad’s rocket manufacturing capabilities and infrastructure.

😂 one less rodent",549194
How many reactions have the message saying Ukrainian refugees found a place to sleep in Britain?,5,Ukraine refugees are loving it in Britain. British people even have them a place to sleep. The ones I work with go back for weeks. That's not a poor refugee,964254
How many reactions have the message asserting that Russia is running out of tanks?,0,"Nice work!  These guys on scooters and motorcycles… completely unprotected..  I guess russia really IS running out of tanks, then?  They sure as hell should be - Ukraine has been disposing of those things at a crazy pace.  No way will russia ever be able to keep up with their losses.  Good.",475763
How many reactions have the message saying the Charon strike group of the Princely Brigade destroyed occupying infantry?,5,"They were going to kill us...

But everything happened on the contrary! 😉
The Charon strike group of the Princely Brigade vividly and effectively destroyed the occupying infantry! 🔥

And so it will be with all enemies!

https://t.me/EveryUkraineWarVideo Subscribe",855644
"How many reactions have the message reporting that 5,000 liters of drinkable water were distributed in southern Gaza?",447,"Mission successful!

Thanks to you, dear subscribers, we were able to distribute 5000 liters of drinkable water in southern Gaza!

This was financed by your donations, and it was done in less than 2 days, huge thanks to all those donated, on behalf of ourselves and the honorable people of Gaza.

Let us keep up the pace and continue alleviating their unbearable pain, and help them get over the destruction and death that ""israel"" caused them.

Every donation matters, no matter how small!

Donations links here",272071
How many reactions have the message stating that the media is asking citizens to buy generators?,0,"Maybe a psywar 🤔
I hope they wait few weeks from now so the paranoia grew more and more in the Zionists 😁
The media is asking citizens to buy generators and keep near bunkers and store food 🤣
They expect a blackout and a big event (fireworks everywhere in the sky 😆)",305761
How many reactions have the message noting that JK Rowling is standing up for women’s rights?,0,I am so glad that JK Rowling is standing up for women's rights. These are not the fake rights of Gloria Steinem.She wanted women to be like men.Gloria 's activism wasn't based on fighting radical Islam that keeps women in chains. She didn't fight against the trafficking of women & children. We must keep  men who think they're women out of women's sports & women's bathrooms. This is women's rights! Jpayne,928085
"How many reactions have the message mentioning $8,000 as a little fortune for some Russians?",0,some russian are so poor that they are willing to die to provide there family with this little fortune of 8000$ live is cheap when you have nothing.,211217
How many reactions have the message reporting that Ireland sends solidarity greetings to Palestine?,6,The pheonix has risen and from the ashes of 23 Palestine will be free. To our sisters and brothers in Palestine The sons and daughters of IRELAND WEEP FOR YOU AND WE SEND SALIDARITY GREETINGS. Your struggle is our struggle always was and always will be. YOUR VICTORY WILL BE THE LAUGHTER OF YOUR CHILDREN. ALLAH AKBAR  AND TIOCFAIDH AR LA 🇮🇪🇵🇸🇵🇸🇮🇪,501655
How many reactions have the message stating that prisoners in Russian captivity were given 300 calories daily?,4,"""In Russian captivity, they gave only 300 calories a day, people's consciousness""

 The defender of Mariupol said that he lost 45 kg during four months of imprisonment

https://t.me/EveryUkraineWarVideo Subscribe",911648
How many reactions have the message claiming a growing panic in Harris because of whom to choose as VP?,1893,"Hearing there is growing panic in Harris of who to choose for VP.

Shapiro has massive liabilities and will anger the Hamas base.

Walz is basically a potato but loyal to the party above all. Extremely radical but the safe pick.

With the market collapsing and war looming in the Middle East, her shotgun wedding is over.

Game on.",925767
How many reactions have the message stating the US DEFCON level has been DEFCON 3 since January 2023?,4,"Yeah. That seems likely.

The US has been on Def Con 3 since January 2023. When they deployed the Einsenhower carrier group to the Gulf, it was likely to be on Def Con 2 (Near nuclear war, 6 hrs or less to full deployment). 

Add the stock market collapse into the current mix of wars, projected election loss for the current regime in Washington & high inflation, we have a perfect storm this month into September.",420364
How many reactions have the message saying Crimea is vital for Ukraine’s future security?,0,"I think when you give someone a weapon it then becomes their decision what to do with it. Similar to gun control in the states. There are no such restrictions on Israel. For good reason. Ukraine has been as diligent as humanly possible on only hitting military or dual use targets. Unlike Russia. They can be trusted to do the right thing. And the west should think on this. If Russia is allowed to win or gain a pause to rearm, they will absorb the toughest, most inventive, smartest army in the world right now. If that thought doesn’t make you wet your knickers, it should. Poland is thinking ahead. So are the Baltic states. The rest including the US better start thinking longer term than what they are. Russia NEEDS the territory of Ukraine because of its industrial base. Getting stronger by the day. They have vast resources they don’t plunder to avoid environmental damage. The Donbas was easy pickins. They can not be allowed to keep the rest that they annexed including Crimea. Which is becoming decidedly uncomfortable these days. Ukraine will never be secure, will never have a successful navy unless they keep Crimea. It’s vital for future security and you better believe NATO would put a base there. That’s what Russia is truly afraid of",922064
How many reactions have the message reporting that Ukraine is starting to worry the West might treat it like Palestine?,7,"While I think of it…

Ukraine is getting concerned the West might treat it like Palestine, in some ways, if that conflict becomes too expensive.

Peace plans where the enemy doesn’t really intend to let you grow into a powerful and rich nation, where they fundamentally say and think that your land will eventually be theirs, that’s something Palestine knows well.

Peace plans where the West tells you “you need to accept to lose a bit more territory than last time we asked you to, and if you refuse, we’ll just turn a blind eye”, that’s something Palestine knows.

I can understand why Zelenskyy is so worried. We don’t have a very good track record.

Hopefully for Ukraine, we understand Ukraine is our Maginot Line against Russia, because if we think we can afford to strong arm Zelensky into a peace deal favorable to Russia, we’re so screwed.",211493
How many reactions have the message asserting that the US state that scares anyone is the US?,17,"it's not Israel that scares anyone, it's the US lurking right behind them. I was in the US military 14 years ago. it's not as good or effective as people think. they project power as a deterrent because they don't want anyone to try it and find out. big bark, small bite. Afghanistan, Vietnam, Korea, Syria, etc. the US when they actually put boots on the ground, is not that significant. I mean Russia Iran China and Yemen all had hypersonic missiles before USA. the US military is a military contractor's auction and that's it.

they standard issue the 5.56 which is meant for soft targets because they don't have what it takes to go up against actual armored peers. they just want to go beat up on civilians. Israel and USA share the same playbook.",268087
How many reactions have the message defining the method of total conquest as financial dominance?,8,"Financial dominance is a method of total conquest. Most citizens have not begun to understand the power and the scope of economic conquest in this reality. In this game, the conquered are slaves to a system designed to demand tribute as stated in the form of taxes, interest, and inflation. The tribute is collected through provisional governments who have formed legal systems that legislate and enact laws that demand payment of taxes and allow for the creation of debt against your labor. You have become a slave without knowing it, without the use of visible force or coercion so that you are now a victim, and you do not realize that you have been conquered. You believe you are paying for your own good, for the good of others, or to protect you from some enemy. Your captors have become your benefactors and protectors. Total control took time as the conspiracy against the entire world demanded double agents working in corporations and government.",1082802
What is the date and the time of the message stating that Iran claims to have obtained nuclear weapons?,2024-08-03 16:48:56,"⚠️ END TIME ALERT ‼️ – Iran has publicly announced for the first time that it has 
nuclear weapons. 

""We have obtained nuclear weapons, but we do not announce it!” said Iranian Politician Ahmed Ardestani. 

Keep always informed
Subscribe to @Intelsky 💫",82482
What is the date and the time of the message reporting that Trump said “Don't sell” about Bitcoin?,2024-08-05 17:13:27,It probably wasn't a good time for Trump to say don't sell your Bitcoin. Or was it ? Who knows what's going to happen with it.,493627
What is the date and the time of the message claiming that AARGM/ER missiles have a classified range?,2024-08-05 02:15:00,"Depending on the variant the harm ranges can be from 30 to 60 miles.  Biden said he would send ""advanced missiles"" The replacement for the AGM 88 is the AARGM and the AARGM/ER.  the AARGM/ER max range is classified but is likely somewhere in the 160 to 180 mile range.",577161
What is the date and the time of the message reporting that Putin hugged FSB killer Krasikov after the exchange?,2024-08-02 15:44:59,"putin hugged FSB killer Krasikov after the exchange. According to the killer’s relative, he personally knows putin and went to the shooting range with him

Arriving at a meeting with Russian intelligence officers at Vnukovo, putin hugged the killer Vadim Krasikov. They have known each other personally for a long time, wrote The Insider, whose journalists spoke with Krasikov’s relative.

According to him, Krasikov talked a lot about ptin and once mentioned that he was with him at the shooting range. 

https://t.me/EveryUkraineWarVideo Subscribe",304976
What is the date and the time of the message reporting that Jenna Ellis is cooperating with the prosecution in the Arizona 'fake electors' case?,2024-08-05 20:13:25,"Arizona Attorney General Kris Mayes’ office announced Monday that Jenna Ellis, a former Donald Trump attorney and one of the 18 defendants in the Arizona “fake electors” case stemming from the 2020 election, is cooperating with the prosecution.

Ellis signed the cooperation agreement Monday morning, according to the announcement, which said prosecutors are dropping the charges against her.

“This agreement represents a significant step forward in our case,” Mayes, a Democrat, said in a statement. “I am grateful to Ms. Ellis for her cooperation with our investigation and prosecution.
READ | XPOST",1082244
What is the date and the time of the message reporting that Erdogan said he would send troops to Palestine if Tel Aviv enters Lebanon?,2024-08-03 16:53:54,"Also:
Secret talks between Cairo and Tehran were fruitful. Charlie; the Zionists have a problem! 

Erdogan: if Tel Aviv enters into Lebanon, we will send troops to Palestine! 

Meanwhile, keep updated
Subscribe to @WW3INFO ✅",545371
What is the date and the time of the message claiming Ronaldo is a Semitic Palestinian Jew from Portugal?,2024-08-03 10:20:17,"The Palestinians and the Portuguese are the sabe Hebrew tribe of biblical Israel and Palestine . See Ronaldo , he is a Semitic Palestinian Jew Sephardic from portugal . The Portuguese Jews come from Jerusalem in 70 AD they were exiled to portugal Sepharad . 
If they had stayed they would today be Palestinian . Ronaldo has the same blood lineageDNA  as Palestinian",599108
What is the date and the time of the message stating that 24 Shahed drones were shot down across Ukraine?,2024-08-03 09:41:28,"Air defense forces shot down 24 out of 29 Shahed drones launched across Ukraine overnight.

The drones were shot down in Kherson, Odesa, Mykolaiv, Poltava, Sumy, Dnipro, Kyiv, Vinnytsia, and Zhytomyr regions.

@liveukraine_media",927267
What is the date and the time of the message reporting that Russia launched a KN-23 missile from North Korea towards Ukraine?,2024-08-05 16:16:02,"Russia has resumed using North Korean ballistic missiles against Ukraine, according to Defense Express. On July 31, Russia launched a KN-23 missile from North Korea towards Bila Tserkva, but it exploded in mid-air over Kyiv region. This is the first use of North Korean missiles in five months. These missiles have a longer range than the Iskander but are highly inaccurate, posing a risk of landing anywhere.",36838
What is the date and the time of the message stating Russian air defense systems intercepted four UAVs over the Krasnodar region?,2024-08-02 08:06:04,"❤️ Hi friends!

Top news of the hour:

▪️ Sevastopol, Crimea, was shelled at night by ATACMS missiles with a cluster munition. Traffic in the city was partially blocked. There is no information on casualties;

▪️ Russian forces attacked facilities in Pavlograd, Krivoy Rog, Kirovograd, Kropivnitsky, Zaporozhye and an airfield in the Nikolayev region last night;

▪️ Russian air defence forces destroyed two Ukrainian UAVs over the Kursk region last night, while four other UAVs were intercepted over the Krasnodar region, the Russian Defence Ministry said.

@ukraine_watch",893306
What is the date and the time of the message reporting that 77% of Russians support a war against Ukraine?,2024-08-04 09:52:43,"🗣  34% of Russians approve of a nuclear strike on Ukraine, 77% of Russians support a war against Ukraine, according to a survey conducted by the Russian analytical Levada Center",568826
What is the date and the time of the message stating that 82 residential buildings were restored in Orlove village?,2024-08-05 08:01:13,"The Rivne Regional Military Administration reported that Rivne builders restored 178 residential buildings in three villages of Kherson oblast affected by the war. The cost of the works reaches UAH 8.4 million.

""Our region takes care of the de-occupied villages of the Kochubeivka territorial community in the Kherson region. For more than a year, Rivne oblast has transferred UAH 8.4 million for restoration work. With this money, the restoration of 178 residential buildings was completed: 82 in the village of Orlove; 72 – Zahradivka village; 24 – Kochubeivka village... It is our duty to support the regions suffering from the war,"" the message of the Rivne Regional Military Administration reads.

It is noted that preparations for the implementation of the second stage of the project are currently underway.

""For this purpose, 296 residential buildings and 3 social infrastructure facilities have already been inspected,"" the Rivne RMA added. The work continues within the framework of the presidential initiative ""Side by Side"" which has already repaired a thousand objects  in Kherson region.

@Ukraine_Report",915272
What is the date and the time of the message reporting that Belgium withdrew from the mixed relay triathlon due to an athlete's illness?,2024-08-04 20:13:57,"🇧🇪 Belgium has withdrawn from Monday's mixed relay triathlon after triathlete Claire Michel fell ill, according to a statement from the National Olympic Committee.

The statement did not specify the nature of Michel’s illness, which emerged days after she swam in the River Seine Poop River during the women's triathlon on Wednesday.

Switzerland has also had to adjust its roster, as athletes from the country became ill after the initial triathlon races last week.",939429
What is the date and the time of the message reporting a fire at CHP 3 in Kharkiv?,2024-08-05 16:09:25,"In Kharkiv, there is a fire at CHP 3, local channels

They write that spontaneous combustion occurred at the cooling tower, which had not worked for more than 20 years.

https://t.me/EveryUkraineWarVideo Subscribe",379244
What is the date and the time of the message reporting that the US Department of Defense has not contacted Iran?,2024-08-02 20:14:24,"🇺🇸🇮🇷The US Department of Defense has not contacted Iran on the topic of preventing escalation in the Middle East, the Pentagon said.

At the same time, the department continues to assure that the United States does not want to see a wide regional conflict and believes that it can be prevented.

🔴 @DDgeopolitics",306071
What is the date and the time of the message reporting that Evan Gershkovich was released by Russia in a prisoner swap with the USA?,2024-08-01 12:23:17,"Russia released Wall Street Journal reporter Evan Gershkovich, former US Marine Paul Whelan, and dissident Vladimir Kara-Murza in a multi-country prisoner swap with the US. In return, the US and its allies will release Russian prisoners.
https://www.bloomberg.com/news/articles/2024-08-01/us-reporter-released-by-russia-in-multi-country-prisoner-swap",390867
What is the date and the time of the message stating that the U.S. weapons package for F-16s includes AGM-88 HARM missiles?,2024-08-04 14:03:08,"Part 2
The weapons for the F-16 that the U.S. is sending include AGM-88 HARM air-to-ground missiles; the extended-range versions of Joint Direct Attack Munition kits, which convert unguided bombs to smart weapons; and so-called small diameter bombs that explode with a tight blast radius. In addition, the U.S. will send advanced medium-range air-to-air missiles, known as AMRAAM, and AIM-9X short-range air-to-air missiles for the jets.
“The aircraft itself is worthless without the weapons,” said Maj. Gen. Rolf Folland, chief of the Royal Norwegian Air Force.
In Europe, many countries were reluctant to send large amounts of their limited inventory of air-launched munitions to Kyiv, so the allies came up with a solution that the Pentagon has dubbed “jumpstart.” European countries can pool their finances to buy air-launched weapons from the U.S. to send to Ukraine, the U.S. official said. 
But arming the F-16s is just one of many challenges facing the Ukrainians when they receive the aircraft. The aircraft, which will eventually number around 80, won’t be delivered all at once. Denmark’s, for instance, will come in stages over eight months.
The U.S. and allies have declined to provide specific timelines for the planes and their weapons because of security concerns.
Ukrainian officials have expressed gratitude to allies for providing the jets, but have complained privately that their arrival, like much Western aid, comes too late, in too small a number and with too many restrictions to alter the war substantially.
Once the jets arrive, the next hurdle will be to ensure there are enough pilots and maintainers to operate them.
Training for F-16s has been a convoluted process conducted across several countries. Some Ukrainian pilots started their English-language training in the U.K. and France, two countries that have never flown the F-16. The flight training is taking place in the U.S., Romania and Denmark, but the Danish facility is shutting down this fall to transition to training on the advanced F-35 combat jets that will replace the country’s F-16s. ",210001
What is the date and the time of the message reporting that Vadim Krasikov was sentenced to life in prison in Germany for murder?,2024-08-01 12:51:21,"🇷🇺🇺🇸 Twenty-four people, including eight Russians, could be exchanged in a swap between Russia, the U.S., Germany and three other countries, CBS reports.

CBS says that among the jailed Russians who could be exchanged is German convict Vadim Krasikov.

He was sentenced to life in prison in Germany in December 2021 for the murder of Georgian citizen Zelimkhan Khangoshvili.

He was probably the one Putin had in mind when he spoke in an interview with Tucker Carlson about a man who ""for patriotic reasons liquidated a bandit in one of the European capitals"".

@ukraine_watch",1087979
What is the date and the time of the message stating that Evan Gershkovich was sentenced to 16 years in prison in Russia for alleged espionage?,2024-08-01 12:02:32,"Wall Street Journal reporter Evan Gershkovich, sentenced to prison in Russia for alleged espionage, will be able to return to the United States tomorrow as part of an exchange. This was reported by Fox News.

Russian media previously reported that a large-scale exchange of prisoners between Russia, Belarus, the USA and Germany will take place in the near future. There is currently no information about this from official russian sources.

The Russian court sentenced Evan Gershkovich to 16 years in prison for allegedly collecting information for the US special services about a tank manufacturer in Yekaterinburg, russia. He and the newspaper rejected the accusations.",218636
What is the date and the time of the message stating Ukraine is working to achieve a 1000 km range for the R-360 'Neptune' missile?,2024-08-03 08:51:49,"Romania plans to collaborate with Ukraine on the development and modernization of the R-360 ""Neptune"" missile. This partnership aims to jointly control the coastal waters of the Black Sea in the post-war period. Currently, Ukraine is working on increasing the missile's range to 1000km and ramp up production. https://armyrecognition.com/news/army-news/army-news-2024/romania-plans-to-jointly-develop-r-360-neptune-missiles-with-ukraine",390287
What is the date and the time of the message stating that Israeli intelligence used WhatsApp to track Hamas leader Ismail Haniyeh?,2024-08-01 11:06:00,"Intelligence Report

Identification of Hamas Politburo Chief via WhatsApp Messenger by Israeli Intelligence

Date: 010824

Source: Lebanese journalist Elia Manier (Information not verified)

Summary:
Israeli intelligence has reportedly identified and targeted Hamas Politburo Chief Ismail Haniyeh using the WhatsApp messenger app. According to Lebanese journalist Elia Manier, the identification was facilitated by spy software allegedly embedded in Haniyeh's phone, leading to a precision strike on his location. The software used is said to be developed by the Israeli company NSO Group.

Elia Manier explained that with the help of this spyware, Israeli intelligence discovered Haniyeh's residence and subsequently launched a drone rocket attack. The journalist claims that the malware, produced and distributed under license by NSO Group, provides hackers access to messages, photos, location data, and control over the phone's camera and microphone.

This incident illustrates the significant security risks associated with using American software for individuals targeted by intelligence agencies. The use of an app owned by Meta, underscores the critical need for heightened digital security awareness among high-profile individuals.

Note: The information provided in this report is based on unverified sources and should be treated with caution. Further verification and corroboration are required to ascertain the credibility and specifics of the incident.

---

End of Report



@meiaagency",316772
What is the date and the time of the message reporting that Ismail Haniyeh was killed by a bomb in Tehran?,2024-08-01 18:04:52,"Hamas politburo chief Ismail Haniyeh was killed by a bomb planted two months ago in a house in Tehran where he had repeatedly stayed, the New York Times reports.

On the day of Haniyeh's death, it was first reported that the building had been hit by a rocket, then that it was a guided aerial bomb.

The NYT, citing unnamed Middle East officials, writes that it was in fact a planted bomb that was detonated immediately after it was confirmed that Haniyeh was in the building.

@ukraine_watch",893857
