question,answer,relevant_doc,doc_id
What is the date and the time of the message mentioning that Fauci has a lot to lose if Trump wins?,2024-07-01 15:09:11,"Those that speak the loudest 

Fauci has a lot to lose if Trump wins",431596
What is the date and the time of the message referring to Ben Carson as a “Gentle Genius”?,2024-06-30 22:43:17,"Absolutely the best characterization of Ben Carson! ""Gentle Genius"", love him! However, Trump will need a strong personality for a running mate... if ever there is an election.",64030
What is the date of the message mentioning the T-64 in relation to the 92nd Assault Brigade?,2024-06-29 16:22:02,"🎼 A Warriors Ukrainian specially composed song for Ukraine's 92nd Assault Brigade! 

In the video you can see a T-64 from 🇺🇦 Ukraine's 92nd Assault Brigade braving a gauntlet of fire to close with and engage Russian positions. 

They suffer multiple hits on the first pass, and still circle back around to come in and engage again.

Glory to Ukraine! Glory to the Heroes!

Thank you for your support!

https://t.me/EveryUkraineWarVideo Subscribe",340658
What is the date and the time of the message stating that the cost of a flag is $450?,2024-06-29 02:28:19,"Guys, I’m writing to you again with an updated video, I hope you like it :)

The cost of the flag is $450

cost of frame gratitude from 110 OMBr 750$

The cost of chevrons varies from $40, we accept orders from $100

The inscription on a 155mm combat shell costs $100

Our goal is to buy 1-2 more drones, the cost of which is 1750 €

Don’t forget every donation is the life of our warriors, Together to victory!

DM - Roman
@WarriorsUkrainianWar",1069839
"What is the date and the time of the message describing Chinese, Russian, and Iranian people as evil?",2024-06-29 18:01:14,"And my resolve and I'm sure the resolve of everyone here to help Ukranians is strengthened by the good we ALL see in the Ukranian people!

Ultimately nations and people are either good and friendly like Ukranians or they're evil like Chinese or Russians or Iranians ....to walk the path of good is always harder!",958621
What is the date and the time of the message suggesting that Biden seems like a morning person?,2024-06-29 03:44:12,"(Ooops, accidentally hit Enter too early and posted that before I was done.  To continue:)

Factors that I think went into Biden’s terrible debate performance:
* He had a cold.  (This was my assumption from his first few lines, and it was confirmed after the debate.)  He clearly should have mentioned that explicitly early on; it would have helped.
* He seems to be a morning person, and Trump seems to be a night owl (witness the tweets at 3:00am when he was president)
* He clearly was trying to squeeze in a bunch of facts and figures (and sometimes getting them wrong) in a short period of time, which often meant he wasted most of his time on stuff that didn’t emotionally connect with his audience.  Trump, by contrast, took the emotional lies he wanted to tell and ran with the same ones over and over.  This was a failure of Biden’s debate prep.
* As is common knowledge, Biden has always had a stutter.  That’s going to be made harder to deal with by illness or fatigue.

None of that excuses Biden’s poor performance; better debate prep (which might mean *less* debate prep!) would have helped a lot with all of that.  But it does mean that the Biden we saw on stage last night is not the only Biden American voters are going to see between now and the election.

Did last night put a smile on Putin’s, Orbán’s, Xi’s, and Khamenei’s faces?  I’m sure it did.  But I don’t think it changed the tragectory of the 2024 US presidential election very much (and some of the tracking polls suggest that it might even, bizarre as this seems, have changed it in Biden’s direction, although I suspect that’s just the direction voter sentiment was already moving in, rather than a consequence of the election).

So I’m disappointed, but still pretty hopeful.  I think Biden’s chances in the election are better than Trump’s (even if they may not be as *much* better as they were on Wednesday).

(As for the idea of replacing Biden with a different candidate, that sounds great if the perfect vetted candidate existed and could unify the Democratic party behind them, but that candidate doesn’t exist and there would be a huge fight over who got to take up the mantle, with the effect that Democrats would still be bitterly divided in November, while Repbublicans had been united behind their candidate for months.  It would be different in a parliamentary system, or a similar system where parties choose their leaders/standardbearers without a primary process, but in the US system as it has evolved it would be a mess, and I don’t think there’s any way the resulting Democratic candidate would be in a better position to win the general election than Biden is now.)",957142
"What is the date and the time of the message estimating 36,000 additional deaths for 2024 if the daily average is 200?",2024-06-29 21:37:08,"Russian opposition outlet Meduza states at least 64,500 Russian men died in the war until end of 2023 as per Russian mortality statistics. In 2023, on average 110 were reported dead per day (statistically more than usually, so caused by the war).

Since this is not including 2024, and these are only the men who were officially reported dead while many bodies have not been recovered yet, the actual number is probably much higher. This year is especially deadly, let's say 200 dead per day, which would add another 36,000 up to today. Then we are at 100k reported dead, and if we speculate that half of the bodies are still missing, you would be at 200k dead. In that case, the casualty numbers published by AFU with 540k dead+wounded+captured would be a good fit.

https://meduza.io/en/feature/2024/06/28/double-the-dead",962388
What is the date and the time of the message about six-year-old Nastia waiting for her father?,2024-06-30 15:43:02,"Iryna can't eat, thinking about how her sons, marines, are starving in captivity. And 10 people from Olena's family are fighting in the war. Her brother was killed, her son-in-law was sentenced to life imprisonment in Russia, and her daughter has been in captivity for three years. Six-year-old Nastia, the daughter of a missing soldier, is waiting for her father to take her and her mother home.

All of them came to the Red Cross
headquarters in Geneva to find out at least something about their relatives. For eight hours, the Ukrainian women asked the organization's representatives questions. At this meeting, they stated bluntly: The Red Cross is inactive. The women also organized demonstrations calling for the release of the prisoners.

https://t.me/EveryUkraineWarVideo Subscribe",340381
What is the date and the time of the message estimating Russia’s daily loss at 1k per day?,2024-06-29 14:15:43,"1k per day losses almost every day, stunning. 

I guess there is a lot more wounded than injured and those are estimates though rather than counting the bodies ?

Bad news is Russia can take these losses for a few years.
It will destroy their country but I doubt Putin cares",505704
"What is the date and the time of the message predicting AfD might join governments in Brandenburg, Saxony, or Thuringia in 2024?",2024-06-30 10:51:52,"In Germany AfD is conducting a party convention this weekend.

One citing from reelected party boss Alice Weidel: 'Ukraine does not belong to EU, and Ukraine does not belong to Europe.'

Perhaps AfD will join the governments of Brandenburg, Saxony or Thuringia in 2024. It will get difficult... 😢",978485
What is the date and the time of the message reporting that the kidnapped 8-year-old Palestinian boy was found in Beit Hanina?,2024-06-29 23:11:35,"Sending our deepest and sincerest  condolences to the family of the Palestinian child Qais Abu Rmelah (8 years), who was kidnapped yesterday's afternoon, and was found today morning drowned in a small lake - Beit Hanina, occupied #Jerusalem.

It's worth noting that the wide-scale searching processes had been hindered for hours by Israeli forces and settlers!",609978
What is the date and the time of the message stating that Obama couldn’t get Joe to step down?,2024-06-29 11:12:05,"Obama couldn't get Joe to step down....they know he can't win. Joe will most likely have a bad ""accident""  by August.  Or WWIII will stop the election altogether",1077490
What is the date and the time of the message describing Belarus as a buffer zone between Russia and Ukraine?,2024-06-29 14:47:01,Lukashenko (Mr potato head) is shit scared of his pint sized master. Putin has obviously ordered him to protect his border. Belarus is just a buffer zone between Russia and Ukraine!,959504
What is the date and the time of the message calling Trump a moderate in the MAGA movement?,2024-06-30 21:19:35,"Steve Bannon tells @VaughnHillyard that former President Trump is a moderate in the MAGA movement, which is moving “farther right.”",350279
What is the date and the time of the message saying Trump made 30 false statements during yesterday’s debate according to CNN?,2024-06-29 11:54:16,"CNN's fact check: Trump made 30 false statements during yesterday's debate, and Biden 9.

https://edition.cnn.com/2024/06/27/politics/fact-checking-the-cnn-presidential-debate/index.html",929324
What is the date and the time of the message stating that the PAC-3 MSE Interceptor’s hit rate in tests is 100%?,2024-06-29 11:01:55,"Oh yes there are. Patriot is by western standard an ageing system. Europe has developed  quite a few as well. And you haven't met THAAT yet then, that is just one of a couple to deal with missile threads. See the video.  Their PAC-3 MSE Interceptor took down a simulated IRBM over Hawaii, shooting from Alaska. 14 tests = 100% hitrate.  https://www.youtube.com/watch?v=WGEdLW5ddcE",929594
What is the date and the time of the message describing Joe Biden as a “substance” person?,2024-06-29 03:08:56,"Just to clarify some things in your commentary.  Joe Biden has to make the decision to run.  Democrats can't change that.  Each party had primary elections in each state and the nominees are Joe Biden for the Democrats and Donald Trump for the Republicans.  The only way that can change is if a nominee will ""release"" the delegates in the convention and allow them to vote for whomever they want but that won't happen.    So we are stuck with both of them.  The problem we have is about 1/3 of the US Population is ""non-affiliated"" as far as a party goes.  That means less people voting in primaries to pick a candidate for a major party.  So, only 2/3 of the population picks the candidate.  However, in the general election, the other 1/3 of non-affiliated will vote for either one of the candidates.  I think this is why we aren't getting the best candidates.   I will support Joe Biden because I know his policies while I can't figure out Trump polices.  As far as the debate went, I see Trump as a snake oil salesmen.  All talk telling people what they want to hear.  It is his style and it appeals to people.  Joe Biden is quiet and focuses of getting things done.  I consider his to be a ""substance"" person.  He doesn't communicate well, don't forget he has a stuttering problem.   One other thing, if you notice, he had a scratching voice.  They said he had a cold. So take that for what it is.  He has never looked this way before and I think the key is to watch that September debate and we will find out.  I would point our Obama did the same thing in his debate but recovered in the next debate.  Let this play out and see what happens.  It really could be bad for Ukraine if Trump wins.",505442
What is the date and the time of the message setting the upper limit of the IDF claim at 18k?,2024-06-29 20:35:49,"18k is the IDF claim, the upper limit. Its not impossible,  but skepticism is indeed warranted",944254
What is the date and the time of the message saying Ukrainian air defense shot down all Shahed drones?,2024-06-29 05:55:40,"Overnight, Russia attacked with 10 Shahed drones, mainly in the southern regions. Ukrainian air defense shot down all of them.",277504
What is the date and the time of the message reporting Finland has supplied €2.2 billion in defense equipment to Ukraine?,2024-06-29 00:02:10,"Finland will send a new package of military aid to Ukraine

The Ministry of Defense of Finland reports that the President of the country, Alexander Stubb, made this decision at the suggestion of the government. This will be the 24th package of military support.

According to estimates, the replacement of the assets included in this batch will cost Finland approximately €159 million.

For operational reasons and in order to ensure the safe provision of assistance, the exact content, methods and terms of providing the package are not disclosed.

The total value of the defense equipment supplied by Finland to Ukraine is currently €2.2 billion.",1069862
What is the date and the time of the message mentioning that an FAB-500 bomb was used for the second time in Kharkiv?,2024-06-30 16:01:25,"⚡⚡ The Russians hit the branch of ""Nova Poshta"" (Post Office) in Kharkiv.

The attack was carried out by a guided aerial bomb FAB-500 from the territory of the ruzzian federation.

This is the second case of using such a weapon in Kharkiv.

As of now, it is known about one dead and nine wounded. In addition, seven people do not get in touch. Search operations are ongoing.

Mayor Terekhov reported that the wounded includes an eight-month-old baby.

https://t.me/EveryUkraineWarVideo Subscribe",340338
What is the date and the time of the message asserting that ballistic missiles in Ukraine come from North Korea with absolute certainty?,2024-06-29 15:37:25,"Weapons research experts provided the UN Security Council with evidence of the Russians' use of North Korean missiles to attack Ukraine.

📌 Jonah Leff, operations director of Conflict Armament Research, a research organization that tracks weapons, revealed to the UN that the remains of ballistic missiles found in Ukraine ""undoubtedly"" come from North Korea.

📌 The director of Conflict Armament Research provided the council with a detailed analysis of the remains of the missile that hit Ukraine's second largest city, Kharkiv, on January 2.

📌 The organization documented the rocket's engine, its tail and nearly 300 components manufactured by 26 companies from eight countries and territories. This KN-23 or KN-24 missile was manufactured in 2023 in the DPRK.

📌The United States at the UN then entered into a dispute with Russia and North Korea at the meeting, saying that both countries violated the UN embargo on arms exports from the DPRK. Russia rejected the ""groundless accusations"", and the DPRK called the meeting ""an extremely brazen act"".

https://t.me/EveryUkraineWarVideo Subscribe",340714
What is the date and the time of the message saying Russia uses a regular live vaccine?,2024-06-29 01:30:15,"Russia uses a regular live vaccine which is safe and proven also, not an experimental RNA editing vaccine never before tested for human use in mass. they may have short sickness after because of immune response to the Russian live vaccine but there should be no long term consequences if it is a regular live vaccine.",262809
What is the date and the time of the message reporting air defense fire can be heard from Oboyansk and Solntsevsky districts?,2024-06-29 22:24:26,"❗️Air defense is active in the Kursk region of ruzzia. A UAV ""threat"" was declared earlier.

According to local residents the air defense fire can be heard in the Oboyansk and Solntsevsky districts.",1069515
What is the date and the time of the message saying 50 Ukrainian F-16 maintenance specialists completed training in Denmark?,2024-06-30 12:54:58,"🇩🇰The first 50 Ukrainian F-16 maintenance specialists have completed training - Danish Air Force Commander Jan Dam

According to Dam, quoted by Nyheder, specialists have already returned to Ukraine and will prepare the conditions for receiving the first fighters.

The training of the first group of Ukrainian pilots is now being completed - they are mastering night flights.

Earlier this week it became known that Denmark will train about 20 Ukrainian pilots by the end of the year. In addition, about 100 Ukrainians must be trained to perform support tasks. We are talking about mechanics, weapons specialists and ground personnel for Ukrainian air bases.

@worldnewschat",556845
What is the date and the time of the message noting that video quality makes it difficult to confirm Russian claims?,2024-06-29 20:48:04,"An Iskander-M missile looks to have struck a Ukrainian military train at the Ukrainka station in Zaporizhia region, 50 km from the front line. Russian sources claim the destruction of M113s, BUK-M1s, BMP-1s, and trucks, but the video quality makes it difficult to confirm. Regardless, the impact is significant.",276375
"What is the date and the time of the message praising the Kpist m/45 as a simple, durable, and reliable weapon?",2024-06-30 23:00:33,"Sweden's 1940s answer to the British Sten gun spotted in Ukraine - Forces News

Ever heard of the Swedish K? Well just after the Second World War ended Carl Gustaf developed Sweden's answer to the British Sten submachine gun – the Kpist m/45.

It's a simple and well-designed weapon that became known for being durable and reliable.

Initially used by the Swedish armed forces, it later became a favourite with the Americans.",1068378
What is the date and the time of the message reporting that Ali al-Din was killed in a drone strike in Sohmor?,2024-06-30 13:26:49,"The IDF confirms carrying out a drone strike earlier today in southern Lebanon's Sohmor, killing a member of Hezbollah's aerial forces.

According to the military, the Hezbollah operative, identified by the terror group as Ali al-Din, was behind drone attacks on northern Israel.

Separately, the IDF says fighter jets struck buildings used by the terror group in Houla and Aitaroun. It adds that troops also shelled areas in southern Lebanon with artillery.

Meanwhile, two explosive-laden drones launched by Hezbollah at the Western Galilee struck areas near Rosh Hanikra earlier, the military confirms.

The IDF says there are no injuries in the attack. Hezbollah took responsibility, claiming to have targeted a Navy base.",572080
What is the date and the time of the message stating Hezbollah used a drone before attacking Israeli targets?,2024-06-30 17:29:21,"⭕️ Hezbullah released footage of their attack on an Israeli Merkava tank and Namer APC parked inside an Israeli base using a short range Almas ATGM.

Before attacking they used a drone to scan for targets. The Israeli army obviously didn't acknowledge the event.

Extent of damage is unclear, but the vehicles could be repaired.",1139928
What is the date and the time of the message saying Morocco granted permission for an Israeli warship to dock after Spain refused?,2024-06-29 21:17:27,"Morocco granted permission for an Israeli warship to dock after Spain refused.

The difference between progressive left government and a moderate muslim one",500593
What is the date and the time of the message reporting an 11% decrease in Muslim Albanians compared to the previous census?,2024-06-30 17:34:35,"Albania is no longer a Muslim majority country.  For the 1st time in 200 years according to recent census.  The number of Muslim believers dropped to 45.7%. down 11% from previous census.  Iran is heading in the same direction too!  

Muslim: 45.7% (-11)
Non believer: 19.4% (+11.4)
No answer: 10% (-6.2)
Catholic: 8.4% (-1.6)   
Orthodox: 7.2% (0.4)   
Bektashi: 4.8% (+2.7)
Atheist: 4% (+1.5)",306708
What is the date and the time of the message defining the Israel-China relationship as tricky?,2024-06-30 14:43:56,"You mean Israel doesn’t supply the West with weapons, technology and intelligence, not to mention products and demand for Western markets? That’s news to most of us. Israel would love to help Ukraine, but RuZZia’s air control in Syria makes that dangerous. Still, Israel has supplied Ukraine with humanitarian and anti-drone aid. Israel’s relationship with China has always been tricky. For now, Israel has bigger fish to fry, like a war on two fronts. Seeing how China has allied itself with Iran, expect Israel to wean itself off China.",977903
What is the date and the time of the message stating that Lebanese people are closest to the Canaanites?,2024-06-30 06:59:19,"Okay, read genesis 11:27
the Jews believe that Abraham was first Jew on the earth, but where did he come from?🤔🤔
Exactly! He came from Chaldeans, which is Babylonia, which is nowadays Iraq. Uhm saar, what do you think? Oh, and also genesis 12:5 says that God spoke to Abraham and  told him 2go2 Canaan, which is modern day Israel. Indigenous people to Canaan is Canaanites. But did they vanish? Nope😹. They just moved to modern Lebanon😹. And what's the source? Times of Israel! Yea, you won't believe me but I can show you. And modern Lebanese are very closer by DNA to Canaanites than anyone else. 90% of Lebanese has this genes. Cope harder😹😹",611321
What is the date and the time of the message describing the strategy “send limp soldiers” to gain maximum advantage?,2024-07-01 17:11:52,Pooty master strategist sends limp soldiers to battle for maximum advantage 😄,1013695
What is the date and the time of the message saying over 95% of the population trusts the CPC?,2024-07-02 09:08:50,"The CPC is celebrated its 103rd birthday on July 1st.

China’s ruling party is now 99.185 million members strong, the largest political party in the world.

Its achievements? Liberating the country from foreign subjugation, rejuvenating the nation from a poor and backward semi-colony to one of the most fiercely independent, leading the country’s economy from subsistence level to the second largest in GDP terms and largest in PPP terms, eliminating extreme poverty, rising China  🇨🇳 to the ranks of a technological superpower, to name just a few.

The CPC enjoys the trust of over 95 percent of the population.

The empire that pursues its destruction, the USA, has two parties that fail to receive even half of the trust of the CPC. It is now led politically by a convicted felon oligarch and a cognitively declining warmonger.

The world is watching, and is choosing China 🇨🇳 and its top friend Russia 🇷🇺 in forging a multipolar world. Success is contagious.

Subscribe to China 🇨🇳 and Geopolitics!",199194
What is the date and the time of the message stating the US military doesn’t do anything without a plan?,2024-07-02 07:10:26,"This is great - I know the US military doesn’t take a crap without a plan, so this is an important part of it - to ensure the katsaps cannot just locate and destroy Ukraine’s new toys.  This is one reason why it’s been taking so long… I can’t wait for F-16s to be in Ukrainian skies… 🇺🇦🇺🇦🇺🇦",509760
What is the date and the time of the message describing Russia’s demographic issue as a broken demographic pyramid amplified by war?,2024-07-02 20:50:03,Russia's demographic pyramid is broken and amplified by the war which will be catastrophic in a few years. China has the same problem.,144547
What is the date and the time of the message saying Biden is afraid of prison?,2024-07-01 21:28:23,Biden won't step down or stop his campaign because he's afraid of prison for himself and his crime family,717109
What is the date and the time of the message comparing Trump to Marius?,2024-07-01 18:30:16,"Not dying Roman Empire, dying Roman Republic.  Trump is the beginning of the death of democracy like Marius was in the late Republic.  By the end of the century if this path is continued to its conclusion we will see the American Empire.",511340
What is the date and the time of the message describing the terrifying reality that the US is becoming the Divided States of America?,2024-07-02 18:31:30,"As a US citizen I emphatically say those two are not the best we can do.  Far from it.  But that raises important topics for questioning regarding our systems as they stand:  the corruption and corruptability of people, what is the nature of the systems (the people behind them) regarding what they allow and what they deny, and the frail nature of unity that binds disparate ideas and people together, despite differences, towards a common shared vision of independence, happiness, and political stability.  

America is quickly losing grasp of  “the unifying foundational ideas” that helped to serve as the bedrock of our nation at its founding. 

Were are becoming the divided states of America, and that is a terrifying reality.",539363
